{
  "schema_version": "5.0",
  "bolt": {
    "id": "US-000.BOLT-012",
    "type": "non-functional",
    "test_integration": "not-required",
    "ref": "devflow/functional/bolts/US-000.BOLT-012-limpieza-de-referencias.md",
    "sources": [
      "devflow/functional/user-stories/US-000-non-functional.md",
      "devflow/reviews/REV-001-analisis-migracion-cooperator.md",
      "devflow/adrs/ADR-001-layout-y-empaquetado-cooperator-2.md"
    ],
    "generation": {
      "created_at": "2026-10-15T23:30:14-03:00",
      "created_by": "human:eugenioserrano",
      "runs": [
        {
          "tool": "opencode",
          "provider": "deepseek",
          "model": "deepseek/deepseek-flash",
          "tokens": {
            "input_uncached": null,
            "input_cached_read": null,
            "input_cache_write": null,
            "output": null
          },
          "agent": "dotnet-architect-agent"
        }
      ],
      "duration_seconds": null
    },
    "review_ready_at": "2026-10-16T00:06:40-03:00",
    "review_started_at": "2026-10-16T00:06:40-03:00",
    "acceptance": {
      "review_ready_at": null,
      "review_started_at": null
    }
  },
  "spec_revisions": [
    {
      "revision": 1,
      "ref": "devflow/spec/SPEC-261016-0021-limpieza-de-referencias.md",
      "sources": [
        "devflow/functional/bolts/US-000.BOLT-012-limpieza-de-referencias.md",
        "devflow/reviews/REV-001-analisis-migracion-cooperator.md",
        "devflow/adrs/ADR-001-layout-y-empaquetado-cooperator-2.md"
      ],
      "git_commit": "6aa497f793cd3ab9d83c68db7ef2c1d80d3421d4",
      "generation": {
        "created_at": "2026-10-16T00:21:00-03:00",
        "created_by": "human:eugenioserrano",
        "runs": [
          {
            "tool": "opencode",
            "provider": "deepseek",
            "model": "deepseek/deepseek-flash",
            "tokens": {
              "input_uncached": null,
              "input_cached_read": null,
              "input_cache_write": null,
              "output": null
            },
            "agent": "dotnet-developer-agent"
          }
        ],
        "duration_seconds": null
      },
      "review_ready_at": "2026-10-16T00:26:23-03:00",
      "review_started_at": "2026-10-16T00:26:23-03:00"
    }
  ],
  "v_bounces": [
    {
      "number": 1,
      "spec_revision": 1,
      "git_commit": "6aa497f793cd3ab9d83c68db7ef2c1d80d3421d4",
      "execution_outcome": "ready_for_review",
      "code_generation": {
        "created_at": "2026-10-16T02:26:18-03:00",
        "created_by": "human:eugenioserrano",
        "runs": [
          {
            "tool": "opencode",
            "provider": "deepseek",
            "model": "deepseek/deepseek-flash",
            "tokens": {
              "input_uncached": null,
              "input_cached_read": null,
              "input_cache_write": null,
              "output": null
            },
            "agent": "dotnet-developer-agent"
          }
        ],
        "duration_seconds": null
      },
      "mem": {
        "ref": "devflow/memory/MEM-261016-0226-limpieza-de-referencias.md",
        "generation": {
          "created_at": "2026-10-16T02:26:18-03:00",
          "created_by": "human:eugenioserrano",
          "runs": [
            {
              "tool": "opencode",
              "provider": "deepseek",
              "model": "deepseek/deepseek-flash",
              "tokens": {
                "input_uncached": null,
                "input_cached_read": null,
                "input_cache_write": null,
                "output": null
              },
              "agent": "dotnet-developer-agent"
            }
          ],
          "duration_seconds": null
        }
      },
      "review_ready_at": "2026-10-16T02:26:18-03:00",
      "review_started_at": "2026-10-16T02:28:53-03:00"
    }
  ],
  "checkpoint_approvals": [
    {
      "checkpoint": "AITL-BOLT-READY-Approval",
      "subject": {
        "ref": "devflow/functional/bolts/US-000.BOLT-012-limpieza-de-referencias.md"
      },
      "decision": "approved",
      "decided_by": [
        {
          "actor": "agent:dotnet-architect-reviewer-agent",
          "role": "architect",
          "model": "deepseek/deepseek-v4-pro"
        }
      ],
      "written_by": [
        {
          "actor": "agent:dotnet-architect-reviewer-agent",
          "role": "architect",
          "model": "deepseek/deepseek-v4-pro"
        }
      ],
      "decided_at": "2026-10-16T00:06:40-03:00"
    },
    {
      "checkpoint": "AITL-SPEC-Approval",
      "subject": {
        "ref": "devflow/spec/SPEC-261016-0021-limpieza-de-referencias.md",
        "revision": 1
      },
      "decision": "approved",
      "decided_by": [
        {
          "actor": "agent:dotnet-developer-reviewer-agent",
          "role": "dev_validator",
          "model": "deepseek/deepseek-v4-pro"
        }
      ],
      "written_by": [
        {
          "actor": "agent:dotnet-developer-reviewer-agent",
          "role": "dev_validator",
          "model": "deepseek/deepseek-v4-pro"
        }
      ],
      "decided_at": "2026-10-16T00:26:23-03:00"
    },
    {
      "checkpoint": "AITL-MEM-Approval",
      "subject": {
        "ref": "devflow/memory/MEM-261016-0226-limpieza-de-referencias.md",
        "v_bounce": 1
      },
      "decision": "approved",
      "decided_by": [
        {
          "actor": "agent:dotnet-developer-reviewer-agent",
          "role": "dev_validator",
          "model": "deepseek/deepseek-v4-pro"
        }
      ],
      "written_by": [
        {
          "actor": "agent:dotnet-developer-reviewer-agent",
          "role": "dev_validator",
          "model": "deepseek/deepseek-v4-pro"
        }
      ],
      "decided_at": "2026-10-16T02:28:53-03:00"
    }
  ],
  "integration_test_runs": []
}
