{
  "schema_version": "5.0",
  "bolt": {
    "id": "US-012.BOLT-003",
    "type": "functional",
    "test_integration": "required",
    "ref": "devflow/functional/bolts/US-012.BOLT-003-invoice-download.md",
    "sources": [
      "devflow/functional/user-stories/US-012-invoices.md"
    ],
    "generation": {
      "created_at": "2026-08-02T10:15:00-03:00",
      "created_by": "human:eugenio.serrano",
      "runs": [
        {
          "tool": "opencode",
          "provider": "openrouter",
          "model": "anthropic/claude-sonnet-4.7",
          "tokens": {
            "input_uncached": 4900,
            "input_cached_read": 1200,
            "input_cache_write": 0,
            "output": 950
          },
          "agent": null
        }
      ],
      "duration_seconds": 38
    },
    "review_ready_at": "2026-08-02T10:20:00-03:00",
    "review_started_at": "2026-08-02T10:22:00-03:00",
    "acceptance": {
      "review_ready_at": "2026-08-02T12:15:00-03:00",
      "review_started_at": "2026-08-02T12:18:00-03:00"
    }
  },
  "spec_revisions": [
    {
      "revision": 1,
      "ref": "devflow/spec/SPEC-260802-1042-invoice-download.md",
      "sources": [
        "devflow/functional/bolts/US-012.BOLT-003-invoice-download.md",
        "devflow/functional/user-stories/US-012-invoices.md",
        "devflow/tests/test-cases/TC-027-invoice-download.md",
        "devflow/adrs/ADR-009-billing-storage.md"
      ],
      "git_commit": "7f6c9a2",
      "generation": {
        "created_at": "2026-08-02T10:42:00-03:00",
        "created_by": "human:eugenio.serrano",
        "runs": [
          {
            "tool": "codex",
            "provider": "openai",
            "model": "gpt-5.6",
            "tokens": {
              "input_uncached": 13200,
              "input_cached_read": 5200,
              "input_cache_write": 0,
              "output": 3200
            },
            "agent": "avenga-devflow"
          }
        ],
        "duration_seconds": 164
      },
      "review_ready_at": "2026-08-02T10:50:00-03:00",
      "review_started_at": "2026-08-02T10:55:00-03:00"
    },
    {
      "revision": 2,
      "ref": "devflow/spec/SPEC-260802-1042-invoice-download.md",
      "sources": [
        "devflow/functional/bolts/US-012.BOLT-003-invoice-download.md",
        "devflow/functional/user-stories/US-012-invoices.md",
        "devflow/tests/test-cases/TC-027-invoice-download.md",
        "devflow/adrs/ADR-009-billing-storage.md"
      ],
      "git_commit": "7f6c9a2",
      "generation": {
        "created_at": "2026-08-02T11:18:00-03:00",
        "created_by": "human:eugenio.serrano",
        "runs": [
          {
            "tool": "codex",
            "provider": "openai",
            "model": "gpt-5.6",
            "tokens": {
              "input_uncached": 6500,
              "input_cached_read": 3100,
              "input_cache_write": 0,
              "output": 1250
            },
            "agent": null
          }
        ],
        "duration_seconds": 71
      },
      "review_ready_at": "2026-08-02T11:25:00-03:00",
      "review_started_at": "2026-08-02T11:26:00-03:00"
    }
  ],
  "v_bounces": [
    {
      "number": 1,
      "spec_revision": 2,
      "git_commit": "7f6c9a2",
      "execution_outcome": "ready_for_review",
      "code_generation": {
        "created_at": "2026-08-02T11:35:00-03:00",
        "created_by": "human:dev1",
        "runs": [
          {
            "tool": "opencode",
            "provider": "anthropic",
            "model": "claude-sonnet-4.7",
            "tokens": {
              "input_uncached": 30800,
              "input_cached_read": 11800,
              "input_cache_write": 0,
              "output": 8900
            },
            "agent": "developer-agent"
          }
        ],
        "duration_seconds": 1220
      },
      "mem": {
        "ref": "devflow/memory/MEM-260802-1138-invoice-download.md",
        "generation": {
          "created_at": "2026-08-02T11:38:00-03:00",
          "created_by": "human:dev1",
          "runs": [
            {
              "tool": "opencode",
              "provider": "anthropic",
              "model": "claude-sonnet-4.7",
              "tokens": {
                "input_uncached": 6100,
                "input_cached_read": 2100,
                "input_cache_write": 0,
                "output": 1450
              },
              "agent": "developer-agent"
            }
          ],
          "duration_seconds": 42
        }
      },
      "review_ready_at": "2026-08-02T11:40:00-03:00",
      "review_started_at": "2026-08-02T12:05:00-03:00"
    }
  ],
  "checkpoint_approvals": [
    {
      "checkpoint": "AITL-US-Approval",
      "subject": {
        "ref": "devflow/functional/user-stories/US-012-invoices.md"
      },
      "decision": "approved",
      "decided_by": [
        {
          "actor": "human:fa.name",
          "role": "functional_analyst",
          "model": null
        }
      ],
      "decided_at": "2026-08-02T09:55:00-03:00",
      "comment": null
    },
    {
      "checkpoint": "AITL-BOLT-READY-Approval",
      "subject": {
        "ref": "devflow/functional/bolts/US-012.BOLT-003-invoice-download.md"
      },
      "decision": "approved",
      "decided_by": [
        {
          "actor": "human:fa.name",
          "role": "functional_analyst",
          "model": null
        }
      ],
      "written_by": [
        {
          "actor": "human:fa.name",
          "role": "functional_analyst",
          "model": null
        }
      ],
      "decided_at": "2026-08-02T10:25:00-03:00",
      "comment": null
    },
    {
      "checkpoint": "AITL-SPEC-Approval",
      "subject": {
        "ref": "devflow/spec/SPEC-260802-1042-invoice-download.md",
        "revision": 1
      },
      "decision": "changes_requested",
      "decided_by": [
        {
          "actor": "human:eugenio.serrano",
          "role": "dev_validator",
          "model": null
        },
        {
          "actor": "human:fa.name",
          "role": "functional_analyst",
          "model": null
        }
      ],
      "written_by": [
        {
          "actor": "human:eugenio.serrano",
          "role": "dev_validator",
          "model": null
        }
      ],
      "decided_at": "2026-08-02T11:05:00-03:00",
      "comment": "Add explicit concurrency handling."
    },
    {
      "checkpoint": "AITL-SPEC-Approval",
      "subject": {
        "ref": "devflow/spec/SPEC-260802-1042-invoice-download.md",
        "revision": 2
      },
      "decision": "approved",
      "decided_by": [
        {
          "actor": "human:eugenio.serrano",
          "role": "dev_validator",
          "model": null
        },
        {
          "actor": "human:fa.name",
          "role": "functional_analyst",
          "model": null
        }
      ],
      "written_by": [
        {
          "actor": "agent:avenga-devflow",
          "role": "coordinator",
          "model": "gpt-5.6"
        }
      ],
      "decided_at": "2026-08-02T11:32:00-03:00",
      "comment": null
    },
    {
      "checkpoint": "AITL-MEM-Approval",
      "subject": {
        "ref": "devflow/memory/MEM-260802-1138-invoice-download.md",
        "v_bounce": 1
      },
      "decision": "approved",
      "decided_by": [
        {
          "actor": "agent:qa-agent",
          "role": "qa",
          "model": "claude-opus-5"
        }
      ],
      "written_by": [
        {
          "actor": "agent:avenga-devflow",
          "role": "coordinator",
          "model": "claude-sonnet-4.7"
        }
      ],
      "decided_at": "2026-08-02T12:10:00-03:00",
      "comment": "Virtual approval example (AITL): developer-agent executed the V-Bounce, qa-agent approved the MEM — approver actor != executor actor (the independence floor, §3.0). A virtual decision is derived from the agent: prefix; there is no stored mode field."
    },
    {
      "checkpoint": "AITL-BOLT-DONE-Approval",
      "subject": {
        "ref": "devflow/functional/bolts/US-012.BOLT-003-invoice-download.md"
      },
      "decision": "approved",
      "decided_by": [
        {
          "actor": "human:po.name",
          "role": "product_owner",
          "model": null
        }
      ],
      "written_by": [
        {
          "actor": "human:po.name",
          "role": "product_owner",
          "model": null
        }
      ],
      "decided_at": "2026-08-02T12:30:00-03:00",
      "comment": null
    }
  ],
  "integration_test_runs": [
    {
      "kind": "run",
      "number": 1,
      "covers": "9b1e4d7",
      "environment": "staging",
      "outcome": "fail",
      "reason": null,
      "evidence": "https://ci.example.com/invoices/runs/101",
      "ran_by": "human:dev1",
      "runner": "github-actions",
      "ran_at": "2026-08-02T12:12:00-03:00"
    },
    {
      "kind": "classification",
      "run": 1,
      "cause": "environment",
      "reason": "The staging database restarted mid-run; the failing checks never reached the change under test.",
      "classified_by": "human:dev1",
      "classified_at": "2026-08-02T12:13:00-03:00"
    },
    {
      "kind": "run",
      "number": 2,
      "covers": "9b1e4d7",
      "environment": "staging",
      "outcome": "pass",
      "reason": null,
      "evidence": "https://ci.example.com/invoices/runs/102",
      "ran_by": "human:dev1",
      "runner": "github-actions",
      "ran_at": "2026-08-02T12:15:00-03:00"
    }
  ]
}
